{
  "$schema": "../skill-schema.json",
  "name": "chief-engineer-blitz",
  "version": "1.0.1",
  "summary": "Doctrine for orchestrated multi-PR blitz delivery against a decomposable objective — six phases (Plan / Spec / Implement / Triage / Validate / Closure), strict critic-finding triage, real exit-criteria validation.",
  "originatingRepo": "momentiq-ai/dark-factory-platform",
  "files": [
    { "template": "SKILL.md.tmpl", "target": "SKILL.md" }
  ],
  "variables": {
    "REPO_NAME": {
      "description": "Display name of the consumer repo (e.g. 'Dark Factory Platform').",
      "source": "darkfactory.yaml: repo.displayName",
      "default": "this repo"
    },
    "REPO_SLUG": {
      "description": "Slug of the consumer repo.",
      "source": "darkfactory.yaml: repo.slug, or git remote inference",
      "default": ""
    },
    "OWNER_REPO": {
      "description": "GitHub `<owner>/<repo>` reference for the consumer (used in gh commands).",
      "source": "git remote get-url origin (inferred), or darkfactory.yaml: repo.ownerRepo",
      "default": ""
    },
    "CYCLE_DOCS_DIR": {
      "description": "Repo-relative path to the cycle-docs directory.",
      "source": "darkfactory.yaml: docs.cycleDocsDir",
      "default": "docs/roadmap/cycles"
    },
    "ADR_DIR": {
      "description": "Repo-relative path to the ADR directory.",
      "source": "darkfactory.yaml: docs.adrDir",
      "default": "docs/ADR"
    },
    "WORKTREE_ROOT": {
      "description": "Repo-relative path where parallel agent worktrees are created.",
      "source": "darkfactory.yaml: worktreeRoot",
      "default": ".claude/worktrees"
    },
    "QUALITY_GATE_TARGETS": {
      "description": "Newline-separated Make-target commands for the consumer's quality gate (used in spec for implementation prompts).",
      "source": "darkfactory.yaml: qualityGates (array)",
      "default": "make quality-gates",
      "kind": "list"
    },
    "AGENT_COMMITTER_ORG": {
      "description": "Org used in the agentic-committer email convention (claude-code+<handle>@<org>.ai).",
      "source": "darkfactory.yaml: agentCommitterOrg",
      "default": "momentiq"
    }
  }
}
